{
  "schemaVersion": "1.0",
  "modelVersion": "1.0.0",
  "mode": "STAGED_VERSION_CHECK",
  "initialUnits": 1,
  "transactions": [{ "id": "a", "quantity": 1 }],
  "schedule": [
    { "id": "begin-a", "transactionId": "a", "action": "BEGIN" },
    { "id": "decrement-a", "transactionId": "a", "action": "DECREMENT_STOCK" },
    { "id": "abort-a", "transactionId": "a", "action": "ABORT" }
  ]
}
